Concept,Question,Option One,Option Two,Option Three,Option Four,Correct Answer,Note
algorithm,What is an algorithm?,A programming language,A set of instructions to solve a problem,A type of data structure,A hardware component,A set of instructions to solve a problem,Defines a process to achieve a specific task.
algorithm,What is a characteristic of a good algorithm?,Infinite steps,Ambiguity,Finiteness,Random output,Finiteness,Ensures the algorithm terminates.
algorithm,What is the purpose of algorithm analysis?,To write code,To measure efficiency,To design hardware,To debug code,To measure efficiency,Focuses on time and space complexity.
algorithm,What is a common algorithm design technique?,Divide and conquer,Random guessing,Infinite looping,Manual coding,Divide and conquer,Breaks problems into smaller subproblems.
algorithm,What does an algorithm's correctness ensure?,Fast execution,Expected output,Minimal code,Low memory use,Expected output,Guarantees the solution matches the problem.
java,What is the access modifier in Java that restricts access to within the same class?,private,public,protected,default,private,Access modifiers control visibility of class members
java,Which of the following is NOT a primitive data type in Java?,String,int,boolean,char,String,Primitive types store simple values while others are reference types
java,What keyword is used to handle exceptions in Java?,try,throw,catch,All of the above,All of the above,Exception handling involves multiple keywords working together
java,Which method is automatically called when an object is created in Java?,finalize(),main(),constructor(),initialize(),constructor(),This method shares its name with the class
java,In Java, which collection type maintains insertion order and allows duplicates?,ArrayList,HashSet,HashMap,TreeSet,ArrayList,Think about which data structure is an ordered list
python,"In Python, what is the correct way to create a function?",def myFunction():,function myFunction():,create myFunction():,void myFunction():,def myFunction():,Python uses a specific keyword to define functions
python,What is the output of `print(type([]))`?,<class 'list'>,<class 'array'>,<class 'dict'>,<class 'tuple'>,<class 'list'>,This checks the type of an empty pair of square brackets
python,Which of the following is used for multiple line comments in Python?,''' Comment ''',// Comment,/* Comment */,# Comment,''' Comment ''',Python has single and multi-line comment options
python,What does the `len()` function return when called on a dictionary?,Number of key-value pairs,Sum of all keys,Sum of all values,Memory size of the dictionary,Number of key-value pairs,Think about what constitutes an "element" in a dictionary
Python,What is the result of the expression 3 * 4 ** 2 in Python?,48,144,24,18,48,Python follows mathematical order of operations
c++,Which operator is used for memory allocation in C++?,new,malloc,allocate,create,new,"Use 'delete' to free memory allocated with 'new'"
c++,What is the correct syntax to include the iostream header in C++?,#include <iostream>,#include "iostream",#include <iostream.h>,import iostream,#include <iostream>,"Angle brackets are used for standard library headers"
c++,Which of these is a C++ standard template library container?,vector,arraylist,tuple,dictionary,vector,"STL containers include vector, list, map, etc."
c++,What does the 'const' keyword at the end of a member function indicate?,The function can modify the object,The function cannot modify the object,The function returns a constant value,The function is constant time,The function cannot modify the object,"const member functions can be called on const objects"
c++,How do you declare a pure virtual function in C++?,virtual void func() = 0;,abstract void func();,pure virtual void func();,void func() abstract;,virtual void func() = 0;,"Pure virtual functions make a class abstract"
c,What is the correct way to declare a pointer in C?,int ptr;,int *ptr;,pointer int ptr;,ptr int;,int *ptr;,"The asterisk declares a pointer, position doesn't matter (int* ptr also valid)"
c,Which function is used for dynamic memory allocation in C?,alloc(),new(),malloc(),create(),malloc(),"Don't forget to free() memory allocated with malloc()"
c,What does the #include directive do in C?,Includes a library,Imports a module,Inserts file contents,Loads a DLL,Inserts file contents,"#include literally copies file contents during preprocessing"
c,How do you terminate a string in C?,With a period,With \0,With \n,With \t,With \0,"All C strings must be null-terminated with \0"
c,Which operator is used to access struct members?,.,->,::,.,"Dot for direct access, arrow (->) for pointers to structs"
scala,What is Scala primarily known for?,Combining functional and object-oriented programming,Being a purely procedural language,Low-level system programming,Static web pages,Combining functional and object-oriented programming,Blends paradigms for flexibility.
scala,What is a key feature of Scala?,Dynamic typing,Static typing,No type inference,Limited collections,Static typing,Enables type safety at compile time.
scala,What is the purpose of the 'val' keyword in Scala?,To declare a mutable variable,To declare an immutable variable,To define a class,To create a loop,To declare an immutable variable,Ensures the variable cannot be reassigned.
scala,What is a common use case for Scala?,Front-end development,Big data processing with Spark,Database management,Low-level drivers,Big data processing with Spark,Leverages functional programming.
scala,What does Scala's 'case class' provide?,Manual getter/setter methods,Automatic boilerplate code,Dynamic typing,Low-level access,Automatic boilerplate code,Simplifies immutable data structures.
class,What is a class in object-oriented programming?,A loop structure,A blueprint for creating objects,A sorting algorithm,A database query,A blueprint for creating objects,Defines properties and methods.
class,What keyword is used to define a class in Java?,class,struct,interface,enum,class,Fundamental to OOP in Java.
class,What is a feature of a class?,Encapsulation,Random access,Fixed size,Unordered data,Encapsulation,Bundles data and methods.
class,What is a class constructor used for?,Sorting objects,Initializing objects,Deleting objects,Filtering objects,Initializing objects,Sets initial state.
class,What can a class inherit from?,Another class,A variable,A loop,A function,Another class,Supports code reuse through inheritance.
arrays,What is an array in programming?,A collection of key-value pairs,An ordered collection of elements of the same type,A tree structure,A graph structure,An ordered collection of elements of the same type,Stores elements in contiguous memory.
arrays,What is a key feature of arrays?,Dynamic sizing,Fixed size in most languages,Unordered elements,Key-value mapping,Fixed size in most languages,Size is often defined at creation.
arrays,What is the time complexity for accessing an element in an array?,O(n),O(1),O(log n),O(n^2),O(1),Direct indexing provides constant time access.
arrays,What is a limitation of arrays?,Fast insertion at the beginning,Fixed size in many languages,Dynamic resizing,Random access,Fixed size in many languages,Resizing requires copying.
arrays,What operation can cause an array to overflow?,Appending beyond capacity,Accessing an element,Sorting the array,Searching an element,Appending beyond capacity,Leads to errors in fixed-size arrays.
variables,What is a variable in programming?,A fixed value,A storage location with a name and type,A loop structure,A sorting algorithm,A storage location with a name and type,Holds data during execution.
variables,What keyword declares a variable in Python?,var,let,def,There is no keyword,There is no keyword,Python uses direct assignment.
variables,What is a benefit of using variables?,Hardcoding values,Code reusability,Increased complexity,Fixed data,Code reusability,Allows dynamic data manipulation.
variables,What is a scope of a variable?,Its data type,Its visibility in the program,Its memory size,Its default value,Its visibility in the program,Determines where it can be accessed.
variables,What happens if a variable is undeclared in JavaScript?,It is automatically declared,It throws an error,It becomes global,It defaults to null,It throws an error,Strict mode enforces declaration.
dsa,What does DSA stand for?,Data Structures and Algorithms,Dynamic System Analysis,Data Sorting Algorithms,Distributed System Architecture,Data Structures and Algorithms,Core of efficient programming.
dsa,What is a primary goal of DSA?,Styling code,Optimizing problem-solving efficiency,Debugging hardware,Encrypting data,Optimizing problem-solving efficiency,Focuses on performance.
dsa,What is a common data structure in DSA?,Loop,Array,Function,Class,Array,Fundamental for organizing data.
dsa,What algorithm type is often studied in DSA?,Sorting,Styling,Rendering,Filtering,Sorting,Examples include quicksort and mergesort.
dsa,What is a benefit of learning DSA?,Increased complexity,Better problem-solving skills,More memory usage,Slower execution,Better problem-solving skills,Improves coding efficiency.
oop,What does OOP stand for?,Object-Oriented Programming,Operational Order Processing,Optimal Output Programming,Ordered Object Protocol,Object-Oriented Programming,Focuses on objects and classes.
oop,What is a principle of OOP?,Encapsulation,Random access,Fixed size,Unordered data,Encapsulation,Protects data integrity.
oop,What is a benefit of OOP?,Code reusability,Increased complexity,More memory usage,Slower execution,Code reusability,Through inheritance and polymorphism.
oop,What language is known for OOP?,Java,SQL,HTML,CSS,Java,Designed with OOP principles.
oop,What is a disadvantage of OOP?,Simplicity,Learning curve,Low memory usage,Fast execution,Learning curve,Requires understanding of concepts.
Loops,What is a loop in programming?,A conditional statement,A structure to repeat code,A sorting algorithm,A data structure,A structure to repeat code,Executes code multiple times.
Loops,What loop type checks the condition before executing?,for loop,while loop,do-while loop,foreach loop,while loop,Condition-first evaluation.
Loops,What is a common use of loops?,Single execution,Iteration over data,Fixed data,Random access,Iteration over data,Processes collections.
Loops,What happens in an infinite loop?,It terminates,It runs indefinitely,It sorts data,It compresses data,It runs indefinitely,Can crash the program.
Loops,What keyword exits a loop early in Python?,break,continue,exit,stop,break,breaks the loop immediately.
Inheritance,What is inheritance in OOP?,Copying variables,Deriving properties from a parent class,Sorting objects,Filtering data,Deriving properties from a parent class,Promotes code reuse.
Inheritance,What keyword enables inheritance in Java?,extends,implements,super,this,extends,Defines the parent-child relationship.
Inheritance,What is a benefit of inheritance?,Increased complexity,Code reusability,More memory usage,Slower execution,Code reusability,Reduces redundancy.
Inheritance,What type of inheritance does Python support?,Single only,Multiple inheritance,Fixed inheritance,No inheritance,Multiple inheritance,Allows flexibility.
Inheritance,What is a risk of inheritance?,Tight coupling,Improved performance,Low memory usage,Simple design,Tight coupling,Child depends on parent.
polymorphism,What is polymorphism in OOP?,Using a single interface for multiple data types,Fixed data types,Random access,Unordered data,Using a single interface for multiple data types,Enhances flexibility.
polymorphism,What type of polymorphism occurs at runtime?,Compile-time,Runtime (Dynamic),Static,No polymorphism,Runtime (Dynamic),Enabled by method overriding.
polymorphism,What is a use case for polymorphism?,Fixed data,Dynamic behavior,Sorting data,Filtering data,Dynamic behavior,Adapts to object types.
polymorphism,What language feature supports polymorphism?,Method overriding,Fixed methods,Static typing,Random access,Method overriding,Allows runtime flexibility.
polymorphism,What is a limitation of polymorphism?,Increased flexibility,Complexity in design,Low memory usage,Fast execution,Complexity in design,Requires careful planning.
closure,What is a closure in programming?,A loop structure,A function with access to its lexical scope,A sorting algorithm,A data structure,A function with access to its lexical scope,Retains outer variables.
closure,What language commonly uses closures?,JavaScript,SQL,HTML,CSS,JavaScript,Enables powerful patterns.
closure,What is a benefit of using closures?,Increased complexity,Data encapsulation,More memory usage,Slower execution,Data encapsulation,Protects variables.
closure,What is a use case for closures?,Fixed data,Event handlers,Random access,Filtering data,Event handlers,Maintains state.
closure,What is a limitation of closures?,Memory efficiency,Memory overhead,Simple design,Fast execution,Memory overhead,Retains variables longer.
list,What is a list in programming?,A fixed-size data structure,An ordered collection of elements,A key-value pair structure,A graph-based structure,An ordered collection of elements,Commonly mutable in languages like Python.
list,What operation is typically fast on a list?,Random access,Deletion from middle,Insertion at beginning,Sorting,Random access,Depends on list implementation.
list,What is a key feature of lists in Python?,Immutability,Dynamic sizing,Fixed length,Unordered elements,Dynamic sizing,Allows adding or removing elements.
list,How can you access the last element of a list in Python?,list[-1],list[0],list[length],list[end],list[-1],Negative indexing is a Python feature.
list,What happens if you append to a full fixed-size list?,It resizes automatically,It raises an exception,It overwrites data,It creates a new list,It raises an exception,Depends on language implementation.
array,What is an array in programming?,A collection of key-value pairs,An ordered collection of elements of the same type,A tree structure,A graph structure,An ordered collection of elements of the same type,Same as arrays above, repeated for keyword match.
array,What is a key feature of arrays?,Dynamic sizing,Fixed size in most languages,Unordered elements,Key-value mapping,Fixed size in most languages,Size is often defined at creation.
array,What is the time complexity for accessing an element in an array?,O(n),O(1),O(log n),O(n^2),O(1),Direct indexing provides constant time access.
array,What is a limitation of arrays?,Fast insertion at the beginning,Fixed size in many languages,Dynamic resizing,Random access,Fixed size in many languages,Resizing requires copying.
array,What operation can cause an array to overflow?,Appending beyond capacity,Accessing an element,Sorting the array,Searching an element,Appending beyond capacity,Leads to errors in fixed-size arrays.
interface,What is an interface in programming?,A concrete class,A contract for methods classes must implement,A loop structure,A data type,A contract for methods classes must implement,Ensures consistency.
interface,What keyword defines an interface in Java?,interface,class,struct,enum,interface,Specifies abstract methods.
interface,What is a benefit of using interfaces?,Increased complexity,Loose coupling,More memory usage,Slower execution,Loose coupling,Promotes modularity.
interface,Can an interface have method implementations in Java 8+?,No,Yes with default methods,Never,Only with static methods,Yes with default methods,Introduced in Java 8.
interface,What is a use case for interfaces?,Fixed data,Polymorphism,Random access,Filtering data,Polymorphism,Enables multiple implementations.
function,What is a function in programming?,A variable type,A reusable block of code with a specific task,A data structure,A loop structure,A reusable block of code with a specific task,Promotes modularity.
function,What keyword defines a function in Python?,def,func,function,declare,def,Standard syntax in Python.
function,What is a benefit of using functions?,Increased complexity,Code reusability,More memory usage,Slower execution,Code reusability,Reduces redundancy.
function,What is a parameter in a function?,Return value,Input to the function,Loop variable,Data type,Input to the function,Allows customization.
function,What is a return value?,Input parameter,Output of the function,Loop condition,Variable scope,Output of the function,Provides result to caller.
pointer,What is a pointer in programming?,A variable storing a memory address,A loop structure,A data type,A sorting algorithm,A variable storing a memory address,Used in low-level languages.
pointer,What symbol is used to declare a pointer in C?,*,&,%,#,*,Denotes pointer type.
pointer,What is a use case for pointers?,Fixed data,Dynamic memory allocation,Random access,Filtering data,Dynamic memory allocation,Manages memory efficiently.
pointer,What is a risk of using pointers?,Improved performance,Memory leaks,Low memory usage,Simple design,Memory leaks,Requires careful management.
pointer,What does dereferencing a pointer do?,Allocates memory,Accesses the value at the memory address,Deletes memory,Sorts memory,Accesses the value at the memory address,Uses the * operator in C.
dictionary,What is a dictionary in programming?,A sorted list,A key-value pair data structure,A tree structure,A graph structure,A key-value pair data structure,Also called a map.
dictionary,What is a key feature of dictionaries?,Fixed size,Fast lookups,Unordered elements,Slow access,Fast lookups,Uses hashing for efficiency.
dictionary,What is a common operation in a dictionary?,Random access,Inserting key-value pairs,Sorting elements,Filtering data,Inserting key-value pairs,Core functionality.
dictionary,What is a limitation of dictionaries?,Fast access,Memory overhead,Low memory usage,Simple design,Memory overhead,Depends on hash table size.
dictionary,What language uses dictionaries natively?,Python,SQL,HTML,CSS,Python,Built-in dict type.
abstraction,What is abstraction in OOP?,Exposing all details,Hiding complexity and showing essentials,Sorting data,Filtering data,Hiding complexity and showing essentials,Simplifies interaction.
abstraction,What is a tool for abstraction?,Abstract class,Loop structure,Fixed data,Random access,Abstract class,Provides a blueprint.
abstraction,What is a benefit of abstraction?,Increased complexity,Simplified design,More memory usage,Slower execution,Simplified design,Reduces cognitive load.
abstraction,What is a use case for abstraction?,Fixed data,Database layers,Random access,Filtering data,Database layers,Hides implementation details.
abstraction,What is a limitation of abstraction?,Improved performance,Loss of control,Low memory usage,Fast execution,Loss of control,May hide necessary details.
virtual function,What is a virtual function in C++?,A function that can be overridden in derived classes,A static function,A loop function,A fixed function,A function that can be overridden in derived classes,Enables runtime polymorphism.
virtual function,What keyword defines a virtual function?,virtual,static,private,public,virtual,Marks the function for overriding.
virtual function,What is a use case for virtual functions?,Fixed data,Dynamic behavior,Random access,Filtering data,Dynamic behavior,Supports polymorphism.
virtual function,What is a requirement for virtual functions?,Same signature in base and derived,Fixed signature,Different signatures,Static binding,Same signature in base and derived,Ensures proper overriding.
virtual function,What is a limitation of virtual functions?,Improved performance,Overhead from vtable,Low memory usage,Fast execution,Overhead from vtable,Impacts performance slightly.
module,What is a module in programming?,A standalone program,A file containing reusable code,A loop structure,A data type,A file containing reusable code,Promotes modularity.
module,What keyword imports a module in Python?,import,include,require,load,import,Standard syntax in Python.
module,What is a benefit of using modules?,Increased complexity,Code organization,More memory usage,Slower execution,Code organization,Improves maintainability.
module,What is a use case for modules?,Fixed data,Library creation,Random access,Filtering data,Library creation,Shares functionality.
module,What is a limitation of modules?,Improved performance,Dependency management,Low memory usage,Fast execution,Dependency management,Requires careful handling.
prototype,What is a prototype in JavaScript?,A loop structure,An object from which others inherit properties,A data type,A sorting algorithm,An object from which others inherit properties,Core to JavaScript inheritance.
prototype,What property accesses an object's prototype?,__proto__,__init__,__class__,__type__,__proto__,Links to parent prototype.
prototype,What is a benefit of using prototypes?,Increased complexity,Memory efficiency,More memory usage,Slower execution,Memory efficiency,Shares methods across instances.
prototype,What is a use case for prototypes?,Fixed data,Inheritance,Random access,Filtering data,Inheritance,Extends functionality.
prototype,What is a limitation of prototypes?,Improved performance,Complexity in debugging,Low memory usage,Fast execution,Complexity in debugging,Prototype chain can be tricky.
structure,What is a structure in programming?,A loop structure,A user-defined data type grouping variables,A sorting algorithm,A database query,A user-defined data type grouping variables,Common in C with 'struct'.
structure,What keyword defines a structure in C?,struct,class,interface,enum,struct,Groups related data.
structure,What is a benefit of using structures?,Increased complexity,Data organization,More memory usage,Slower execution,Data organization,Improves readability.
structure,What is a limitation of structures?,Improved performance,Lack of methods,Low memory usage,Fast execution,Lack of methods,Not as powerful as classes.
structure,What is a use case for structures?,Fixed data,Record keeping,Random access,Filtering data,Record keeping,Stores heterogeneous data.
lambda function,What is a lambda function in programming?,A named function,An anonymous function defined inline,A loop structure,A data type,An anonymous function defined inline,Concise syntax.
lambda function,What keyword defines a lambda function in Python?,lambda,def,func,function,lambda,Creates small functions.
lambda function,What is a use case for lambda functions?,Fixed data,Sorting with custom keys,Random access,Filtering data,Sorting with custom keys,Used with map/filter.
lambda function,What is a benefit of lambda functions?,Increased complexity,Conciseness,More memory usage,Slower execution,Conciseness,Reduces boilerplate code.
lambda function,What is a limitation of lambda functions?,Improved performance,Limited complexity,Low memory usage,Fast execution,Limited complexity,Best for simple operations.
encapsulation,What is encapsulation in OOP?,Exposing all data,Bundling data and methods with access control,A sorting algorithm,A data structure,Bundling data and methods with access control,Protects data integrity.
encapsulation,What is a tool for encapsulation?,Private access modifier,Public access,Fixed data,Random access,Private access modifier,Limits direct access.
encapsulation,What is a benefit of encapsulation?,Increased complexity,Data protection,More memory usage,Slower execution,Data protection,Prevents misuse.
encapsulation,What is a use case for encapsulation?,Fixed data,Secure APIs,Random access,Filtering data,Secure APIs,Controls data access.
encapsulation,What is a limitation of encapsulation?,Improved performance,Added complexity,Low memory usage,Fast execution,Added complexity,Requires careful design.
template,What is a template in C++?,A loop structure,A blueprint for creating generic classes/functions,A data type,A sorting algorithm,A blueprint for creating generic classes/functions,Enables type flexibility.
template,What keyword defines a template in C++?,template,class,struct,enum,template,Precedes the definition.
template,What is a benefit of using templates?,Increased complexity,Type safety,More memory usage,Slower execution,Type safety,Ensures compile-time checks.
template,What is a use case for templates?,Fixed data,Generic programming,Random access,Filtering data,Generic programming,Creates reusable code.
template,What is a limitation of templates?,Improved performance,Code bloat,Low memory usage,Fast execution,Code bloat,Generates multiple instantiations.
set,What is a set in programming?,A sorted list,A collection of unique elements,A tree structure,A graph structure,A collection of unique elements,Eliminates duplicates.
set,What is a key feature of sets?,Duplicates allowed,Unordered unique elements,Fixed size,Slow access,Unordered unique elements,Order may vary.
set,What is a common operation in a set?,Random access,Adding elements,Sorting elements,Filtering data,Adding elements,Ensures uniqueness.
set,What is a limitation of sets?,Fast access,Lack of indexing,Low memory usage,Simple design,Lack of indexing,No direct position access.
set,What language uses sets natively?,Python,SQL,HTML,CSS,Python,Built-in set type.
linked list,What is a linked list?,A collection of nodes where each node points to the next,A fixed-size array,A tree-based structure,A hash table,A collection of nodes where each node points to the next,Memory is not contiguous.
linked list,What is a disadvantage of linked lists?,Fast random access,Slow random access due to traversal,Fixed size,High memory overhead,Slow random access due to traversal,Requires traversal.
linked list,What operation is efficient in a linked list?,Inserting at the end,Random access,Deleting from middle,Sorting,Inserting at the end,If tail pointer is maintained.
linked list,How are nodes connected in a linked list?,By indices,By pointers,By keys,By values,By pointers,Each node references the next.
