Concept,Question,Option One,Option Two,Option Three,Option Four,Correct Answer,Note
status codes,What are status codes?,Responses indicating request status,Sorting codes,Filtering codes,Compression codes,Responses indicating request status,HTTP feedback.
status codes,What does 404 mean?,Not Found,OK,Server Error,Redirect,Not Found,Resource unavailable.
status codes,What is a use case for status codes?,Random access,Error handling,Filtering data,Sorting data,Error handling,Informs clients.
status codes,What is a benefit of status codes?,Increased complexity,Communication,More memory usage,Slower execution,Communication,Standardized feedback.
status codes,What is a limitation of status codes?,Improved performance,Ambiguity,Low memory usage,Fast execution,Ambiguity,Requires interpretation.
frontend,What is frontend in web development?,Client-side interface,Server-side logic,Sorting interface,Filtering interface,Client-side interface,User-facing layer.
frontend,What technology builds frontend?,HTML,SQL,Python,C++,HTML,Structures content.
frontend,What is a use case for frontend?,Random access,User interaction,Filtering data,Sorting data,User interaction,Enhances experience.
frontend,What is a benefit of frontend?,Increased complexity,Responsiveness,More memory usage,Slower execution,Responsiveness,Improves usability.
frontend,What is a limitation of frontend?,Improved performance,Browser dependency,Low memory usage,Fast execution,Browser dependency,Varies across devices.
backend,What is backend in web development?,Server-side logic,Client-side interface,Sorting logic,Filtering logic,Server-side logic,Handles data.
backend,What technology supports backend?,Node.js,HTML,CSS,JavaScript,Node.js,Server execution.
backend,What is a use case for backend?,Random access,Data processing,Filtering data,Sorting data,Data processing,Manages logic.
backend,What is a benefit of backend?,Increased complexity,Security,More memory usage,Slower execution,Security,Controls access.
backend,What is a limitation of backend?,Improved performance,Scalability issues,Low memory usage,Fast execution,Scalability issues,Handles load.
frameworks,What are frameworks in programming?,Structures for application development,Sorting tools,Filtering tools,Compression tools,Structures for application development,Simplifies coding.
frameworks,What is an example of a framework?,React,HTML,CSS,JavaScript,React,Component-based UI.
frameworks,What is a use case for frameworks?,Random access,App development,Filtering data,Sorting data,App development,Speeds up process.
frameworks,What is a benefit of frameworks?,Increased complexity,Productivity,More memory usage,Slower execution,Productivity,Provides tools.
frameworks,What is a limitation of frameworks?,Improved performance,Learning curve,Low memory usage,Fast execution,Learning curve,Requires training.
react,What is React?,A JavaScript library for building UIs,Sorting library,Filtering library,Compression library,A JavaScript library for building UIs,Component-based.
react,What feature uses JSX in React?,Components,Loops,Variables,Arrays,Components,Enhances syntax.
react,What is a use case for React?,Random access,Single-page apps,Filtering data,Sorting data,Single-page apps,Dynamic interfaces.
react,What is a benefit of React?,Increased complexity,Reusability,More memory usage,Slower execution,Reusability,Component reuse.
react,What is a limitation of React?,Improved performance,Learning curve,Low memory usage,Fast execution,Learning curve,Requires expertise.
angular,What is Angular?,A platform for building web applications,Sorting platform,Filtering platform,Compression platform,A platform for building web applications,Full-featured framework.
angular,What feature uses TypeScript in Angular?,Components,Loops,Variables,Arrays,Components,Enhances typing.
angular,What is a use case for Angular?,Random access,Enterprise apps,Filtering data,Sorting data,Enterprise apps,Complex applications.
angular,What is a benefit of Angular?,Increased complexity,Structure,More memory usage,Slower execution,Structure,Provides tools.
angular,What is a limitation of Angular?,Improved performance,Steep learning curve,Low memory usage,Fast execution,Steep learning curve,Complex setup.
vue js,What is Vue.js?,A progressive JavaScript framework,Sorting framework,Filtering framework,Compression framework,A progressive JavaScript framework,Lightweight UI.
vue js,What directive binds data in Vue.js?,v-bind,ng-bind,v-if,v-for,v-bind,Links attributes.
vue js,What is a use case for Vue.js?,Random access,Small apps,Filtering data,Sorting data,Small apps,Simple projects.
vue js,What is a benefit of Vue.js?,Increased complexity,Ease of use,More memory usage,Slower execution,Ease of use,Quick integration.
vue js,What is a limitation of Vue.js?,Improved performance,Smaller community,Low memory usage,Fast execution,Smaller community,Limited resources.
node js,What is Node.js?,A JavaScript runtime for server-side,Sorting runtime,Filtering runtime,Compression runtime,A JavaScript runtime for server-side,Non-blocking I/O.
node js,What module manages HTTP in Node.js?,http,fs,os,path,http,Handles requests.
node js,What is a use case for Node.js?,Random access,Real-time apps,Filtering data,Sorting data,Real-time apps,Handles events.
node js,What is a benefit of Node.js?,Increased complexity,Performance,More memory usage,Slower execution,Performance,Non-blocking.
node js,What is a limitation of Node.js?,Improved performance,CPU-intensive tasks,Low memory usage,Fast execution,CPU-intensive tasks,Single-threaded.
express js,What is Express.js?,A web framework for Node.js,Sorting framework,Filtering framework,Compression framework,A web framework for Node.js,Simplifies routing.
express js,What method sets up a route?,app.get(),app.post(),app.put(),app.delete(),app.get(),Handles GET requests.
express js,What is a use case for Express.js?,Random access,API development,Filtering data,Sorting data,API development,Quick setup.
express js,What is a benefit of Express.js?,Increased complexity,Simplicity,More memory usage,Slower execution,Simplicity,Minimalist design.
express js,What is a limitation of Express.js?,Improved performance,Limited features,Low memory usage,Fast execution,Limited features,Requires middleware.
django,What is Django?,A high-level Python web framework,Sorting framework,Filtering framework,Compression framework,A high-level Python web framework,Full-stack.
django,What feature uses ORM in Django?,Models,Views,Templates,URLs,Models,Database abstraction.
django,What is a use case for Django?,Random access,Web development,Filtering data,Sorting data,Web development,Rapid development.
django,What is a benefit of Django?,Increased complexity,Security,More memory usage,Slower execution,Security,Built-in protections.
django,What is a limitation of Django?,Improved performance,Monolithic nature,Low memory usage,Fast execution,Monolithic nature,Less flexibility.
flask,What is Flask?,A micro web framework in Python,Sorting framework,Filtering framework,Compression framework,A micro web framework in Python,Lightweight.
flask,What decorator defines a route?,@app.route(),@route(),@get(),@post(),@app.route(),Maps URLs.
flask,What is a use case for Flask?,Random access,Small apps,Filtering data,Sorting data,Small apps,Simple projects.
flask,What is a benefit of Flask?,Increased complexity,Flexibility,More memory usage,Slower execution,Flexibility,Minimalist design.
flask,What is a limitation of Flask?,Improved performance,Limited features,Low memory usage,Fast execution,Limited features,Requires extensions.
cookies,What are cookies?,Small data stored on the client,Sorting data,Filtering data,Compression data,Small data stored on the client,Tracks sessions.
cookies,What method sets a cookie in JavaScript?,document.cookie,window.cookie,navigator.cookie,location.cookie,document.cookie,Adds key-value pairs.
cookies,What is a use case for cookies?,Random access,Session tracking,Filtering data,Sorting data,Session tracking,Remembers users.
cookies,What is a benefit of cookies?,Increased complexity,State management,More memory usage,Slower execution,State management,Maintains context.
cookies,What is a limitation of cookies?,Improved performance,Size limit,Low memory usage,Fast execution,Size limit,4KB max.
sessions,What are sessions?,Server-side storage of user data,Sorting data,Filtering data,Compression data,Server-side storage of user data,Tracks state.
sessions,What mechanism supports sessions?,Session ID,Loop ID,Variable ID,Array ID,Session ID,Unique identifier.
sessions,What is a use case for sessions?,Random access,User authentication,Filtering data,Sorting data,User authentication,Maintains login.
sessions,What is a benefit of sessions?,Increased complexity,Security,More memory usage,Slower execution,Security,Server-side control.
sessions,What is a limitation of sessions?,Improved performance,Server load,Low memory usage,Fast execution,Server load,Scales with users.
websockets,What are WebSockets?,Real-time bidirectional communication,Sorting communication,Filtering communication,Compression communication,Real-time bidirectional communication,Persistent connection.
websockets,What protocol is used by WebSockets?,WebSocket,HTTP,TCP,UDP,WebSocket,Low-latency.
websockets,What is a use case for WebSockets?,Random access,Live updates,Filtering data,Sorting data,Live updates,Chat apps.
websockets,What is a benefit of WebSockets?,Increased complexity,Low latency,More memory usage,Slower execution,Low latency,Real-time interaction.
websockets,What is a limitation of WebSockets?,Improved performance,Server load,Low memory usage,Fast execution,Server load,Scales with connections.
sdlc,What does SDLC stand for?,Software Development Life Cycle,Sorting Development Life Cycle,Filtering Development Life Cycle,Compression Development Life Cycle,Software Development Life Cycle,Manages development.
sdlc,What phase involves testing?,Testing,Planning,Design,Coding,Testing,Verifies functionality.
sdlc,What is a use case for SDLC?,Random access,Project management,Filtering data,Sorting data,Project management,Structures development.
sdlc,What is a benefit of SDLC?,Increased complexity,Organization,More memory usage,Slower execution,Organization,Improves process.
sdlc,What is a limitation of SDLC?,Improved performance,Rigidity,Low memory usage,Fast execution,Rigidity,Less flexibility.
agile methodology,What is Agile methodology?,Iterative development approach,Sorting approach,Filtering approach,Compression approach,Iterative development approach,Emphasizes adaptability.
agile methodology,What practice uses sprints in Agile?,Scrum,Waterfall,Spiral,V-Model,Scrum,Time-boxed iterations.
agile methodology,What is a use case for Agile?,Random access,Software development,Filtering data,Sorting data,Software development,Handles change.
agile methodology,What is a benefit of Agile?,Increased complexity,Flexibility,More memory usage,Slower execution,Flexibility,Adapts to needs.
agile methodology,What is a limitation of Agile?,Improved performance,Unpredictability,Low memory usage,Fast execution,Unpredictability,Requires discipline.
scrum,What is Scrum?,An Agile framework for managing work,Sorting framework,Filtering framework,Compression framework,An Agile framework for managing work,Uses sprints.
scrum,What role defines product goals?,Product Owner,Scrum Master,Developer,Tester,Product Owner,Prioritizes backlog.
scrum,What is a use case for Scrum?,Random access,Team collaboration,Filtering data,Sorting data,Team collaboration,Manages tasks.
scrum,What is a benefit of Scrum?,Increased complexity,Transparency,More memory usage,Slower execution,Transparency,Improves communication.
scrum,What is a limitation of Scrum?,Improved performance,Complexity,Low memory usage,Fast execution,Complexity,Requires training.
waterfall model,What is the Waterfall model?,A linear development process,Sorting process,Filtering process,Compression process,A linear development process,Sequential phases.
waterfall model,What phase follows design?,Implementation,Planning,Testing,Deployment,Implementation,Builds product.
waterfall model,What is a use case for Waterfall?,Random access,Construction projects,Filtering data,Sorting data,Construction projects,Fixed requirements.
waterfall model,What is a benefit of Waterfall?,Increased complexity,Clarity,More memory usage,Slower execution,Clarity,Defined stages.
waterfall model,What is a limitation of Waterfall?,Improved performance,Inflexibility,Low memory usage,Fast execution,Inflexibility,Hard to adapt.
version control,What is version control?,Tracking changes to code,Sorting code,Filtering code,Compressing code,Tracking changes to code,Manages history.
version control,What system is widely used?,Git,HTML,CSS,JavaScript,Git,Distributed control.
version control,What is a use case for version control?,Random access,Collaboration,Filtering data,Sorting data,Collaboration,Team development.
version control,What is a benefit of version control?,Increased complexity,History tracking,More memory usage,Slower execution,History tracking,Reverts changes.
version control,What is a limitation of version control?,Improved performance,Learning curve,Low memory usage,Fast execution,Learning curve,Requires understanding.
git,What is Git?,A distributed version control system,Sorting system,Filtering system,Compression system,A distributed version control system,Tracks changes.
git,What command initializes a repository?,git init,git commit,git push,git pull,git init,Starts a project.
git,What is a use case for Git?,Random access,Code management,Filtering data,Sorting data,Code management,Teamwork.
git,What is a benefit of Git?,Increased complexity,Flexibility,More memory usage,Slower execution,Flexibility,Offline work.
git,What is a limitation of Git?,Improved performance,Complexity,Low memory usage,Fast execution,Complexity,Steep learning.
github,What is GitHub?,A platform for hosting Git repositories,Sorting platform,Filtering platform,Compression platform,A platform for hosting Git repositories,Collaboration tool.
github,What feature supports collaboration?,Pull requests,Commits,Branches,Tags,Pull requests,Review changes.
github,What is a use case for GitHub?,Random access,Open-source projects,Filtering data,Sorting data,Open-source projects,Shares code.
github,What is a benefit of GitHub?,Increased complexity,Community,More memory usage,Slower execution,Community,Wide adoption.
github,What is a limitation of GitHub?,Improved performance,Dependency on internet,Low memory usage,Fast execution,Dependency on internet,Offline limits.
commits,What are commits in Git?,Snapshots of changes,Sorting changes,Filtering changes,Compression changes,Snapshots of changes,Records history.
commits,What command creates a commit?,git commit,git push,git pull,git init,git commit,Saves changes.
commits,What is a use case for commits?,Random access,Change tracking,Filtering data,Sorting data,Change tracking,Documents progress.
commits,What is a benefit of commits?,Increased complexity,Traceability,More memory usage,Slower execution,Traceability,Reverts errors.
commits,What is a limitation of commits?,Improved performance,Frequent overhead,Low memory usage,Fast execution,Frequent overhead,Requires discipline.
branches,What are branches in Git?,Parallel lines of development,Sorting lines,Filtering lines,Compression lines,Parallel lines of development,Supports experimentation.
branches,What command creates a branch?,git branch,git commit,git push,git pull,git branch,Defines new line.
branches,What is a use case for branches?,Random access,Feature development,Filtering data,Sorting data,Feature development,Isolates work.
branches,What is a benefit of branches?,Increased complexity,Isolation,More memory usage,Slower execution,Isolation,Prevents conflicts.
branches,What is a limitation of branches?,Improved performance,Merge conflicts,Low memory usage,Fast execution,Merge conflicts,Requires resolution.
merging,What is merging in Git?,Combining changes from branches,Sorting changes,Filtering changes,Compression changes,Combining changes from branches,Integrates work.
merging,What command performs a merge?,git merge,git commit,git push,git pull,git merge,Joins branches.
merging,What is a use case for merging?,Random access,Code integration,Filtering data,Sorting data,Code integration,Unites features.
merging,What is a benefit of merging?,Increased complexity,Collaboration,More memory usage,Slower execution,Collaboration,Teamwork.
merging,What is a limitation of merging?,Improved performance,Conflict resolution,Low memory usage,Fast execution,Conflict resolution,Requires manual fixes.
pull requests,What are pull requests?,Requests to merge changes,Sorting requests,Filtering requests,Compression requests,Requests to merge changes,Facilitates review.
pull requests,What platform uses pull requests?,GitHub,HTML,CSS,JavaScript,GitHub,Collaboration tool.
pull requests,What is a use case for pull requests?,Random access,Code review,Filtering data,Sorting data,Code review,Ensures quality.
pull requests,What is a benefit of pull requests?,Increased complexity,Transparency,More memory usage,Slower execution,Transparency,Improves feedback.
pull requests,What is a limitation of pull requests?,Improved performance,Overhead,Low memory usage,Fast execution,Overhead,Requires approval.
continuous integration,What is continuous integration?,Automating code integration,Sorting integration,Filtering integration,Compression integration,Automating code integration,Improves reliability.
continuous integration,What tool supports CI?,Jenkins,HTML,CSS,JavaScript,Jenkins,Build automation.
continuous integration,What is a use case for CI?,Random access,Build validation,Filtering data,Sorting data,Build validation,Detects issues.
continuous integration,What is a benefit of CI?,Increased complexity,Speed,More memory usage,Slower execution,Speed,Fast feedback.
continuous integration,What is a limitation of CI?,Improved performance,Setup cost,Low memory usage,Fast execution,Setup cost,Initial investment.
continuous deployment,What is continuous deployment?,Automatically deploying code changes,Sorting deployment,Filtering deployment,Compression deployment,Automatically deploying code changes,Enhances delivery.
continuous deployment,What tool supports CD?,CircleCI,HTML,CSS,JavaScript,CircleCI,Deployment automation.
continuous deployment,What is a use case for CD?,Random access,Production release,Filtering data,Sorting data,Production release,Fast delivery.
continuous deployment,What is a benefit of CD?,Increased complexity,Automation,More memory usage,Slower execution,Automation,Reduces manual effort.
continuous deployment,What is a limitation of CD?,Improved performance,Risk of bugs,Low memory usage,Fast execution,Risk of bugs,Requires testing.
testing,What is testing in software?,Verifying code functionality,Sorting code,Filtering code,Compressing code,Verifying code functionality,Ensures quality.
testing,What type of testing checks units?,Unit testing,Integration testing,System testing,Acceptance testing,Unit testing,Tests components.
testing,What is a use case for testing?,Random access,Bug detection,Filtering data,Sorting data,Bug detection,Improves reliability.
testing,What is a benefit of testing?,Increased complexity,Reliability,More memory usage,Slower execution,Reliability,Reduces errors.
testing,What is a limitation of testing?,Improved performance,Time-intensive,Low memory usage,Fast execution,Time-intensive,Requires effort.
procedural programming,What is procedural programming?,Programming using procedures or functions,Sorting programming,Filtering programming,Compression programming,Programming using procedures or functions,Step-based.
procedural programming,What language uses procedural programming?,C,JavaScript,Python,HTML,C,Structured approach.
procedural programming,What is a use case for procedural programming?,Random access,Scripting,Filtering data,Sorting data,Scripting,Simple tasks.
procedural programming,What is a benefit of procedural programming?,Increased complexity,Simplicity,More memory usage,Slower execution,Simplicity,Easy to follow.
procedural programming,What is a limitation of procedural programming?,Improved performance,Limited reusability,Low memory usage,Fast execution,Limited reusability,No objects.
declarative programming,What is declarative programming?,Describing what to do, not how,Sorting programming,Filtering programming,Compression programming,Describing what to do, not how,Focuses on outcome.
declarative programming,What language uses declarative programming?,SQL,Python,C++,JavaScript,SQL,Query-based.
declarative programming,What is a use case for declarative programming?,Random access,Querying data,Filtering data,Sorting data,Querying data,Defines requirements.
declarative programming,What is a benefit of declarative programming?,Increased complexity,Readability,More memory usage,Slower execution,Readability,Simplifies logic.
declarative programming,What is a limitation of declarative programming?,Improved performance,Less control,Low memory usage,Fast execution,Less control,Abstracts implementation.
imperative programming,What is imperative programming?,Programming by specifying steps,Sorting programming,Filtering programming,Compression programming,Programming by specifying steps,Detail-oriented.
imperative programming,What language uses imperative programming?,C,SQL,HTML,JavaScript,C,Step-by-step execution.
imperative programming,What is a use case for imperative programming?,Random access,System programming,Filtering data,Sorting data,System programming,Low-level tasks.
imperative programming,What is a benefit of imperative programming?,Increased complexity,Control,More memory usage,Slower execution,Control,Direct manipulation.
imperative programming,What is a limitation of imperative programming?,Improved performance,Complexity,Low memory usage,Fast execution,Complexity,Hard to maintain.
concurrent programming,What is concurrent programming?,Executing multiple tasks at once,Sorting tasks,Filtering tasks,Compression tasks,Executing multiple tasks at once,Improves efficiency.
concurrent programming,What technique supports concurrency?,Threads,Loops,Variables,Arrays,Threads,Parallel execution.
concurrent programming,What is a use case for concurrent programming?,Random access,Multi-tasking,Filtering data,Sorting data,Multi-tasking,Handles I/O.
concurrent programming,What is a benefit of concurrent programming?,Increased complexity,Performance,More memory usage,Slower execution,Performance,Leverages CPU.
concurrent programming,What is a limitation of concurrent programming?,Improved performance,Race conditions,Low memory usage,Fast execution,Race conditions,Requires synchronization.
parallel programming,What is parallel programming?,Executing tasks simultaneously on multiple processors,Sorting tasks,Filtering tasks,Compression tasks,Executing tasks simultaneously on multiple processors,Maximizes resources.
parallel programming,What technique supports parallel programming?,Multiprocessing,Loops,Variables,Arrays,Multiprocessing,Parallel execution.
parallel programming,What is a use case for parallel programming?,Random access,Scientific computing,Filtering data,Sorting data,Scientific computing,Handles large data.
parallel programming,What is a benefit of parallel programming?,Increased complexity,Speed,More memory usage,Slower execution,Speed,Utilizes cores.
parallel programming,What is a limitation of parallel programming?,Improved performance,Complexity,Low memory usage,Fast execution,Complexity,Requires coordination.
tcp ip,What does TCP/IP stand for?,Transmission Control Protocol/Internet Protocol,Sorting Control Protocol,Filtering Control Protocol,Compression Control Protocol,Transmission Control Protocol/Internet Protocol,Networking foundation.
tcp ip,What layer handles data transmission?,Network,Application,Presentation,Session,Network,Manages routing.
tcp ip,What is a use case for TCP/IP?,Random access,Internet communication,Filtering data,Sorting data,Internet communication,Enables connectivity.
tcp ip,What is a benefit of TCP/IP?,Increased complexity,Reliability,More memory usage,Slower execution,Reliability,Ensures delivery.
tcp ip,What is a limitation of TCP/IP?,Improved performance,Overhead,Low memory usage,Fast execution,Overhead,Adds latency.
http,What is HTTP?,HyperText Transfer Protocol,Sorting Protocol,Filtering Protocol,Compression Protocol,HyperText Transfer Protocol,Web communication.
http,What method requests a resource?,GET,POST,PUT,DELETE,GET,Retrieves data.
http,What is a use case for HTTP?,Random access,Web browsing,Filtering data,Sorting data,Web browsing,Transfers pages.
http,What is a benefit of HTTP?,Increased complexity,Simplicity,More memory usage,Slower execution,Simplicity,Easy implementation.
http,What is a limitation of HTTP?,Improved performance,No security,Low memory usage,Fast execution,No security,Requires HTTPS.
https,What is HTTPS?,HTTP with encryption,Sorting with encryption,Filtering with encryption,Compression with encryption,HTTP with encryption,Secures communication.
https,What protocol enhances HTTPS?,TLS,SSL,TCP,UDP,TLS,Encrypts data.
https,What is a use case for HTTPS?,Random access,Secure websites,Filtering data,Sorting data,Secure websites,Protects data.
https,What is a benefit of HTTPS?,Increased complexity,Security,More memory usage,Slower execution,Security,Prevents eavesdropping.
https,What is a limitation of HTTPS?,Improved performance,Performance overhead,Low memory usage,Fast execution,Performance overhead,Adds computation.
dns,What does DNS stand for?,Domain Name System,Sorting Name System,Filtering Name System,Compression Name System,Domain Name System,Resolves names.
dns,What does DNS translate?,Domain to IP,IP to domain,Port to address,URL to port,Domain to IP,Enables access.
